<?xml version="1.0" encoding="UTF-8"?>
<data_schema xmlns:xsi="http://www.w3.org/2001/XMLSchema-instance" xsi:noNamespaceSchemaLocation="data-schema.xsd">
    <aircraft>
        <weight>
            <WE>5748.915355</WE>
        </weight>
        <other>
            <SFC>1.12328</SFC>
            <DT>0.278366</DT>
        </other>
    </aircraft>
    <reference>
        <ESF>1.0</ESF>
        <Temp>1.0</Temp>
    </reference>
</data_schema>