<?xml version="1.0" encoding="UTF-8"?>
<data_schema xmlns:xsi="http://www.w3.org/2001/XMLSchema-instance" xsi:noNamespaceSchemaLocation="data-schema.xsd">
    <aircraft>
        <geometry>
            <Theta>0.950978</Theta>
        </geometry>
        <weight>
            <WT>49909.58578</WT>
            <WF>7306.20261</WF>
        </weight>
        <other>
            <sigma>1.12255, 1.08170213, 1.0612766, 1.04902128, 1.04085106</sigma>
        </other>
    </aircraft>
</data_schema>