<?xml version="1.0" encoding="UTF-8"?>
<data_schema xmlns:xsi="http://www.w3.org/2001/XMLSchema-instance" xsi:noNamespaceSchemaLocation="data-schema.xsd">
    <aircraft>
        <other>
            <T>0.5</T>
            <D>12193.7018</D>
        </other>
    </aircraft>
    <reference>
            <h>45000.</h>
            <M>1.6</M>
    </reference>
</data_schema>