<?xml version="1.0" encoding="UTF-8"?>
<data_schema xmlns:xsi="http://www.w3.org/2001/XMLSchema-instance" xsi:noNamespaceSchemaLocation="data-schema.xsd">
    <aircraft>
        <weight>
            <WT>49909.58578</WT>
            <WF>7306.20261</WF>
        </weight>
        <other>
            <fin>4.093062</fin>
            <SFC>1.12328</SFC>
        </other>
    </aircraft>
    <reference>
        <h>45000.</h>
        <M>1.6</M>
    </reference>
</data_schema>