<?xml version="1.0" encoding="UTF-8"?>
<data_schema xmlns:xsi="http://www.w3.org/2001/XMLSchema-instance" xsi:noNamespaceSchemaLocation="data-schema.xsd">
    <aircraft>
        <geometry>
            <tc>0.05</tc>
            <AR>5.5</AR>
            <Lambda>55.0</Lambda>
            <Sref>1000.0</Sref>
            <Theta>0.950978</Theta>
        </geometry>
        <weight>
            <WT>49909.58578</WT>
        </weight>
        <other>
            <Cf>1.0</Cf>
        </other>
    </aircraft>
    <reference>
        <h>45000.</h>
        <M>1.6</M>
        <ESF>1.0</ESF>
    </reference>
</data_schema>