<?xml version="1.0" encoding="UTF-8"?>
<data_schema xmlns:xsi="http://www.w3.org/2001/XMLSchema-instance" xsi:noNamespaceSchemaLocation="data-schema.xsd">
    <aircraft>
        <geometry>
            <tc>0.05</tc>
            <AR>5.5</AR>
            <Lambda>55.0</Lambda>
            <Sref>1000.0</Sref>
            <lambda>0.25</lambda>
            <section>1.0</section>
        </geometry>
        <weight>
            <WE>5748.915355</WE>
        </weight>
        <other>
            <L>49909.58578</L>
        </other>
    </aircraft>
</data_schema>